{
  "subdomain": "yoursubdomain",
  "domain": "is-app.top",
  "email_or_discord": "user@example.com or user",
  "github_username": "user",
  "description": "A brief description of the purpose of the subdomain",
  "ttl": 3600,

  "records": {
    "A":     ["1.0.0.1", "1.0.0.2"],
    "AAAA":  ["2000:db8::1", "2000:db8::2"],
    "MX":    ["mail1.example.com", { "priority": 10, "target": "mail2.example.com" }],
    "TXT":   ["v=spf1 include:_spf.example.com ~all"]
  }
}
